{
  "schema_version": 1,
  "story_id": "STORY-010",
  "declared_state": "draft",
  "updated_at": "2026-09-14T06:33:53Z",
  "history": [
    {
      "state": "draft",
      "at": "2026-09-14T01:03:28Z",
      "note": "story workspace created"
    },
    {
      "state": "amigos_running",
      "at": "2026-09-14T01:03:28Z",
      "note": "v0.6 task 2: nothing refuses an edit to a ready story's contract; .amigos/** is unconditionally exempt from the gate"
    },
    {
      "state": "draft",
      "at": "2026-09-14T06:33:53Z",
      "note": "amigos run complete"
    }
  ]
}
