{
  "schema_version": 1,
  "story_id": "STORY-009",
  "declared_state": "draft",
  "updated_at": "2026-09-13T22:56:20Z",
  "history": [
    {
      "state": "draft",
      "at": "2026-09-13T22:42:10Z",
      "note": "story workspace created"
    },
    {
      "state": "amigos_running",
      "at": "2026-09-13T22:42:11Z",
      "note": "v0.6 contract immutability; renumbered from STORY-008, which README section 26 reserves for eval export"
    },
    {
      "state": "draft",
      "at": "2026-09-13T22:56:20Z",
      "note": "amigos run complete; baseline revision and demonstration clause settled by interview"
    }
  ]
}
