{
  "schema_version": 1,
  "story_id": "STORY-006",
  "declared_state": "draft",
  "updated_at": "2026-09-13T14:47:29Z",
  "history": [
    {
      "state": "draft",
      "at": "2026-09-13T02:34:15Z",
      "note": "story workspace created"
    },
    {
      "state": "amigos_running",
      "at": "2026-09-13T02:34:15Z",
      "note": "amigos run: v0.5 /implement, first run with three independent subagents"
    },
    {
      "state": "amigos_running",
      "at": "2026-09-13T14:37:10Z",
      "note": "amigos re-run: first attempt terminated on a session rate limit before any agent returned findings"
    },
    {
      "state": "draft",
      "at": "2026-09-13T14:47:29Z",
      "note": "amigos run complete"
    }
  ]
}
