{
  "schema_version": 1,
  "story_id": "STORY-005",
  "declared_state": "draft",
  "updated_at": "2026-09-13T02:08:09Z",
  "history": [
    {
      "state": "draft",
      "at": "2026-09-13T01:58:03Z",
      "note": "story workspace created"
    },
    {
      "state": "amigos_running",
      "at": "2026-09-13T01:58:03Z",
      "note": "amigos run: v0.4 subagent split"
    },
    {
      "state": "draft",
      "at": "2026-09-13T02:08:09Z",
      "note": "amigos run complete; two questions resolved by interview"
    }
  ]
}
